ID,Name,Type,Detailed Description,Price,Release Date,Platforms,Developers,Genres,Categories,Game Modes,Features,System Requirements (Min.),System Requirements (Rec.),Age Rating,Links
1245620,ELDEN RING,game,"<h1>ELDEN RING Shadow of the Erdtree Edition</h1><p>ELDEN RING Shadow of the Erdtree Edition içeriği:<br>• ELDEN RING<br>• ELDEN RING - Shadow of the Erdtree genişletmesi</p><br><h1>ELDEN RING Shadow of the Erdtree Deluxe Edition</h1><p>ELDEN RING Shadow of the Erdtree Deluxe Edition içeriği:<br>• ELDEN RING<br>• ELDEN RING - Shadow of the Erdtree genişletmesi<br>• ELDEN RING Çizimleri ve Müzikleri<br>• ELDEN RING - Shadow of the Erdtree Çizimleri ve Müzikleri</p><br><h1>Oyun Açıklaması</h1><img class=""bb_img"" src=""https://shared.akamai.steamstatic.com/store_item_assets/steam/apps/1245620/extras/ER_Steam_Gif_616x260.gif?t=1739922037"" /><br>YENİ FANTASTİK AKSİYON ROL YAPMA OYUNU.<br>Tarnished, yüksel ve zarafetin seni yönlendirmesine izin ver. Elden Ring'in gücünü kullan ve Lands Between'de bir Elden Lord ol.<br><br>• Heyecanla Dolu Devasa Bir Dünya<br>Çeşitli olayları içinde barındıran açık arazilerin, karmaşık ve üç boyutlu tasarımlara sahip büyük zindanlarla buluştuğu devasa bir dünya. Yolculukların sırasında, bilinmeyeni keşfetmenin ve tehditlerin üstesinden gelmenin verdiği o tatmin edici başarım hissi seni bekliyor.<br><br>• Karakterini Oluştur<br>Karakterinin görünüşünü özelleştirebilmenin yanı sıra kuşanabildiğin silahlardan, zırhlardan ve büyülerden de dilediğin kombinasyonu oluşturabilirsin. Karakterini oyun tarzına göre şekillendirebilir, istersen güçlü bir savaşçı olmak için fiziksel gücünü arttırabilir, istersen de bir büyü ustası olabilirsin.<br><br>• Bir Efsaneden Esinlenilmiş Destansı Bir Drama<br>Parçalar halinde işlenen çok katmanlı bir hikâye. Karakterlerin çeşitli düşüncelerinin Lands Between'de kesiştiği destansı bir drama.<br><br>• Seni Dolaylı Olarak Başkalarına Bağlayan Eşsiz Bir Çevrimiçi Deneyim<br>Diğer oyuncularla doğrudan etkileşime geçebileceğin ve birlikte seyahat edebileceğiniz çok oyunculu modun yanı sıra oyun, başkalarının varlığını hissetmeni sağlayacak benzersiz bir eşzamansız çevrimiçi unsuru da destekliyor.",$39.99 USD,24 Şub 2022,windows,"FromSoftware, Inc.","Aksiyon, RYO","Tek Oyunculu, Çok Oyunculu, PvP, Çevrimiçi PvP, Eşli, Çevrimiçi Eşli, Steam Başarımları, Tam kontrolcü desteği, Steam Koleksiyon Kartları, Steam Cloud, Aile Paylaşımı","Tek Oyunculu, Çok Oyunculu, PvP, Çevrimiçi PvP, Eşli, Çevrimiçi Eşli, Steam Başarımları, Tam kontrolcü desteği, Steam Koleksiyon Kartları, Steam Cloud, Aile Paylaşımı",,"<strong>Minimum:</strong><br><ul class=""bb_ul""><li>64-bit işlemci ve işletim sistemi gerektirir<br></li><li><strong>İşletim Sistemi:</strong> Windows 10<br></li><li><strong>İşlemci:</strong> INTEL CORE I5-8400 or AMD RYZEN 3 3300X<br></li><li><strong>Bellek:</strong> 12 GB RAM<br></li><li><strong>Ekran Kartı:</strong> NVIDIA GEFORCE GTX 1060 3 GB or AMD RADEON RX 580 4 GB<br></li><li><strong>DirectX:</strong> Sürüm 12<br></li><li><strong>Depolama:</strong> 60 GB kullanılabilir alan<br></li><li><strong>Ses Kartı:</strong> Windows Compatible Audio Device<br></li><li><strong>İlave Notlar:</strong> </li></ul>","<strong>Önerilen:</strong><br><ul class=""bb_ul""><li>64-bit işlemci ve işletim sistemi gerektirir<br></li><li><strong>İşletim Sistemi:</strong> Windows 10/11<br></li><li><strong>İşlemci:</strong> INTEL CORE I7-8700K or AMD RYZEN 5 3600X<br></li><li><strong>Bellek:</strong> 16 GB RAM<br></li><li><strong>Ekran Kartı:</strong> NVIDIA GEFORCE GTX 1070 8 GB or AMD RADEON RX VEGA 56 8 GB<br></li><li><strong>DirectX:</strong> Sürüm 12<br></li><li><strong>Depolama:</strong> 60 GB kullanılabilir alan<br></li><li><strong>Ses Kartı:</strong> Windows Compatible Audio Device<br></li><li><strong>İlave Notlar:</strong> </li></ul>",16,"https://www.bandainamcoent.com/support, "
3098470,Arctic Motel Simulator,game,"<h1>Join our Discord!</h1><p><p class=""bb_paragraph""><img class=""bb_img"" src=""https://shared.akamai.steamstatic.com/store_item_assets/steam/apps/3098470/extras/JoinOurDiscord4.png?t=1739278826"" /></p></p><br><h1>Oyun Açıklaması</h1><br>Kuzey Kutbu her zaman gizemli bir yer olmuştur. Kuzey Kutbu'nda bir motel işletmek de nadir görülen bir deneyimdir. Arctic Motel Simülatörü aracılığıyla, yalnızca Arktik'in iklimini ve değişken hava durumunu simüle etmekle kalmıyoruz, aynı zamanda Arktik tarzı bir motel yönetimi deneyimi de getirmek istiyoruz. Bu, aşağıdaki yönlere yansır:<br><img class=""bb_img"" src=""https://shared.akamai.steamstatic.com/store_item_assets/steam/apps/3098470/extras/Section1_Turkish.png?t=1739278826"" /><br>Kuzey Kutbu geniş ve seyrek nüfuslu bir yerdir. Oyunda, ilkel ormandaki motelin alanını genişletebileceksiniz.<br><br><img class=""bb_img"" src=""https://shared.akamai.steamstatic.com/store_item_assets/steam/apps/3098470/extras/CutTree.gif?t=1739278826"" /><br><img class=""bb_img"" src=""https://shared.akamai.steamstatic.com/store_item_assets/steam/apps/3098470/extras/Section2_Turkish.png?t=1739278826"" /><br>Kuzey Kutbu'nda motel bulmak kolay değil. Buradaki moteller genellikle birçok farklı türde hizmet sunar. Çeşitli tipte odaların kiralanmasının yanı sıra, Arktik spesiyaliteleri satan mağazalar ve Arktik mutfağı sunan restoranlar da size çok para kazandırabilir. Keşfetmenizi bekleyen çamaşırhaneler ve diğer işletmeler de dahil olmak üzere daha fazlası var.<br><br><img class=""bb_img"" src=""https://shared.akamai.steamstatic.com/store_item_assets/steam/apps/3098470/extras/ExpandBusiness1.gif?t=1739278826"" /><br><img class=""bb_img"" src=""https://shared.akamai.steamstatic.com/store_item_assets/steam/apps/3098470/extras/Section3_Turkish.png?t=1739278826"" /><br>Oyuncuların keşfetmesi için sekiz oda tipi hazırladık. Farklı oda tiplerinin kendine has avantajları bulunuyor ve oyuncular tercihlerine göre özgürce seçim yapabiliyor.<br><br><img class=""bb_img"" src=""https://shared.akamai.steamstatic.com/store_item_assets/steam/apps/3098470/extras/Igloo.gif?t=1739278826"" /><br><img class=""bb_img"" src=""https://shared.akamai.steamstatic.com/store_item_assets/steam/apps/3098470/extras/Section4_Turkish.png?t=1739278826"" /><br>Herkes Kuzey Kutbu'nda kışın çok soğuk geçtiğini biliyor ama Kuzey Kutbu'nun hala kendine özgü dört mevsimi var. Kuzey Kutbu'ndaki dört mevsimin hava durumunu ve sıcaklığının yanı sıra bunlara karşılık gelen oynanışı da simüle ediyoruz: yazın oda nemini kontrol etmek ve kışın oda sıcaklığını yönetmek, ilkbahar, yaz ve sonbaharda kiralanabilen karavanlar ve Arktik kışın eskimo kulübeleri.<br><br><img class=""bb_img"" src=""https://shared.akamai.steamstatic.com/store_item_assets/steam/apps/3098470/extras/Seasons.gif?t=1739278826"" /><br><img class=""bb_img"" src=""https://shared.akamai.steamstatic.com/store_item_assets/steam/apps/3098470/extras/Section5_Turkish.png?t=1739278826"" /><br>Kuzey Kutbu'nda çok sayıda vahşi hayvan var, bu nedenle birçok yerde yasal avlanmaya izin veriliyor. Oyunda oyuncular kış av sezonunda yasal olarak avlanabilmektedir. Oyunda ayrıca çeşitli silah türleri mevcuttur ve oyuncular avlanmak için en sevdikleri silahları seçebilirler. Kış Arktik'e özel tarifler de avlanma amaçlarından biridir.<br><br><img class=""bb_img"" src=""https://shared.akamai.steamstatic.com/store_item_assets/steam/apps/3098470/extras/PistolNoUI.gif?t=1739278826"" /><br><img class=""bb_img"" src=""https://shared.akamai.steamstatic.com/store_item_assets/steam/apps/3098470/extras/Section6_Turkish.png?t=1739278826"" /><br>Bir işi büyütmek hiçbir zaman tek bir kişiye bağlı olamaz. Oyunda oyuncular, motelin işini genişletmek için çalışanları ve özel acenteleri işe alabilirler. Oyuncular çalışanları eğitebilir ve işlerini farklı odaklara göre düzenleyebilirler.<br><br><img class=""bb_img"" src=""https://shared.akamai.steamstatic.com/store_item_assets/steam/apps/3098470/extras/Employee.gif?t=1739278826"" /><br><img class=""bb_img"" src=""https://shared.akamai.steamstatic.com/store_item_assets/steam/apps/3098470/extras/Section7_Turkish.png?t=1739278826"" /><br>Oyun çeşitli rastgele olaylarla doludur; örneğin, hileyi araştıran gezgin ortaklar, motelinizde devriye gezen polis, sağlık denetimleri, yabancı olaylar vb. Arktik'te polisin yetersiz varlığı nedeniyle, polisin aranan suçluları tutuklamak için de yardımınıza ihtiyacı var.<br><br><img class=""bb_img"" src=""https://shared.akamai.steamstatic.com/store_item_assets/steam/apps/3098470/extras/EventAndPeople.gif?t=1739278826"" />",$9.29 USD,11 Şub 2025,windows,One Slice of Pizza Games,Simülasyon,"Tek Oyunculu, Steam Başarımları, Aile Paylaşımı","Tek Oyunculu, Steam Başarımları, Aile Paylaşımı",,"<strong>Minimum:</strong><br><ul class=""bb_ul""><li><strong>İşletim Sistemi:</strong> Windows 10<br></li><li><strong>İşlemci:</strong> Intel Core i3<br></li><li><strong>Bellek:</strong> 8 GB RAM<br></li><li><strong>Ekran Kartı:</strong> Nvidia GeForce GTX 960 4GB VRAM<br></li><li><strong>DirectX:</strong> Sürüm 11<br></li><li><strong>Depolama:</strong> 19 GB kullanılabilir alan</li></ul>","<strong>Önerilen:</strong><br><ul class=""bb_ul""><li><strong>İşletim Sistemi:</strong> Windows 10<br></li><li><strong>İşlemci:</strong> Intel Core i5<br></li><li><strong>Bellek:</strong> 16 GB RAM<br></li><li><strong>Ekran Kartı:</strong> Nvidia GeForce GTX 1070 6GB VRAM<br></li><li><strong>DirectX:</strong> Sürüm 12<br></li><li><strong>Depolama:</strong> 19 GB kullanılabilir alan</li></ul>",0,"https://www.reddit.com/r/OneSliceofPizzaGames/, onesliceofpizzagames@gmail.com"
3089130,Retail Company Simulator,game,"<p class=""bb_paragraph"">Retail Company Simulator, bir perakende şirketi işlettiğin birinci şahıs simülasyon oyunudur.</p><p class=""bb_paragraph"">Mütevazı mağazanı devasa bir perakende şirketine dönüştür. </p><p class=""bb_paragraph""></p><p class=""bb_paragraph""><img class=""bb_img"" src=""https://shared.akamai.steamstatic.com/store_item_assets/steam/apps/3089130/extras/Store01_3.gif?t=1742123976"" /></p><p class=""bb_paragraph""></p><h2 class=""bb_tag""><strong>Co-op Modu ve Tek Oyunculu</strong></h2><p class=""bb_paragraph"">Co-op modunda (4 oyuncuya kadar) görevleri arkadaşlarınla paylaş.</p><p class=""bb_paragraph"">Dükkanda ne kadar çok oyuncu olursa, dükkanını o kadar çok talepkar müşteri ziyaret edecektir.</p><p class=""bb_paragraph"">Ayrıca, tek başına da oynayabilir ve dükkandaki her şeyi yönetebilirsin. Fikrini değiştirirsen, arkadaşlarını istediğin zaman davet edebilirsin.</p><p class=""bb_paragraph""></p><p class=""bb_paragraph""></p><p class=""bb_paragraph""></p><h2 class=""bb_tag"">Mağaza İş Akışı  </h2><p class=""bb_paragraph"">Lider markalarla sözleşme imzala, oyun içi bilgisayarla yeni ürünler sipariş et, kutuları aç, ürünleri mağazana yerleştir ve ürünlerin fiyatlarını belirle.</p><p class=""bb_paragraph"">Müşteri memnuniyeti için mağazadaki ürün fiyatlarını belirlerken piyasa fiyatlarını göz önünde bulundur.</p><p class=""bb_paragraph"">Müşteri kaybetmemek için dükkanını her zaman temiz tut. Ayrıca, mali durumunda sızıntıya neden olabilecek bazı kutu kayıplarından kaçınmak için hırsızlara karşı dikkatli ol.</p><p class=""bb_paragraph""><img class=""bb_img"" src=""https://shared.akamai.steamstatic.com/store_item_assets/steam/apps/3089130/extras/Contract01Multi.gif?t=1742123976"" /></p><h2 class=""bb_tag"">Ürünler</h2><p class=""bb_paragraph"">Müşterilerin, tüm ihtiyaçlarını mağazada bulmasını sağlamalısın.</p><p class=""bb_paragraph"">Ürün portföyünü daima genişlet ve müşterilerini memnun et.</p><p class=""bb_paragraph"">Gömlekler, ceketler, pantolonlar, kazaklar, elbiseler, tişörtler, ayakkabılar, şapkalar ve daha fazlası...</p><p class=""bb_paragraph"">Piyasa fiyatlarından haberdar ol ve ürünleri ucuz olduklarında daha fazla satın al.</p><p class=""bb_paragraph""></p><p class=""bb_paragraph""><img class=""bb_img"" src=""https://shared.akamai.steamstatic.com/store_item_assets/steam/apps/3089130/extras/ShelfFill03_1.gif?t=1742123976"" /></p><h2 class=""bb_tag"">Müşteriler</h2><p class=""bb_paragraph"">Müşterilerin bekleme süresini azaltmak için yeterli sayıda kasa ve soyunma odası yerleştir.</p><p class=""bb_paragraph"">Ürünleri kasadan geçir ve müşterilerin ödemelerini nakit veya kartla al.</p><p class=""bb_paragraph"">Online siparişleri tamamlamayı unutma.</p><p class=""bb_paragraph""><img class=""bb_img"" src=""https://shared.akamai.steamstatic.com/store_item_assets/steam/apps/3089130/extras/Checkout01Multi.gif?t=1742123976"" /></p><h2 class=""bb_tag"">Genişletmeler ve Yeni Takım Arkadaşları</h2><p class=""bb_paragraph"">Mağaza seviyeni yükselt ve bütçeni artırarak mağaza ve depo alanını genişlet.</p><p class=""bb_paragraph"">Rafları doldurmak için yeni stokçular işe al.</p><p class=""bb_paragraph"">Kasalardaki uzun kuyrukları en aza indirmek ve müşterilerin bekleme süresini kısaltmak için daha fazla kasa satın al ve yeni kasiyerler işe al.</p><p class=""bb_paragraph""></p><p class=""bb_paragraph""><img class=""bb_img"" src=""https://shared.akamai.steamstatic.com/store_item_assets/steam/apps/3089130/extras/MultiCashier01.gif?t=1742123976"" /></p>",$3.99 USD,6 Ağu 2024,windows,Business Tycoon,"Basit Eğlence, Bağımsız Yapımcı, Simülasyon","Tek Oyunculu, Çok Oyunculu, Eşli, Çevrimiçi Eşli, Steam Başarımları, Steam Koleksiyon Kartları, Steam Cloud, Aile Paylaşımı","Tek Oyunculu, Çok Oyunculu, Eşli, Çevrimiçi Eşli, Steam Başarımları, Steam Koleksiyon Kartları, Steam Cloud, Aile Paylaşımı",,"<strong>Minimum:</strong><br><ul class=""bb_ul""><li>64-bit işlemci ve işletim sistemi gerektirir<br></li><li><strong>İşletim Sistemi *:</strong> Windows 7 64-bit | Windows 8 64-bit | Windows 10 64-bit<br></li><li><strong>İşlemci:</strong> Intel Core i3-6100T | AMD FX-6100<br></li><li><strong>Bellek:</strong> 4 GB RAM<br></li><li><strong>Ekran Kartı:</strong> NVIDIA GeForce GTX 650 | AMD Radeon R7-250X<br></li><li><strong>Depolama:</strong> 3200 MB kullanılabilir alan</li></ul>","<strong>Önerilen:</strong><br><ul class=""bb_ul""><li>64-bit işlemci ve işletim sistemi gerektirir<br></li><li><strong>İşletim Sistemi *:</strong> Windows 7 64-bit | Windows 8 64-bit | Windows 10 64-bit<br></li><li><strong>İşlemci:</strong> Intel Core i5-4460 | AMD FX-6350<br></li><li><strong>Bellek:</strong> 8 GB RAM<br></li><li><strong>Ekran Kartı:</strong> NVIDIA GeForce GTX 750 | AMD Radeon R7-265X<br></li><li><strong>Depolama:</strong> 3200 MB kullanılabilir alan</li></ul>",0,", retailstoregame@gmail.com"
3087650,A Shelter Full of Cats,game,"<img class=""bb_img"" src=""https://shared.akamai.steamstatic.com/store_item_assets/steam/apps/3087650/extras/devcatsbanner.png?t=1741878136"" /><br><br>Herkes bir kahraman olabilir! Bir kedi kurtarıcısının kurtardığı kedilere bakmasına yardım edin ve onların sahiplenilmesini destekleyin! Her kedi sevilmek için bir şansı hak eder. ❤️<br><br>A Shelter Full of Cats, özel ihtiyaçları olan kediler için özel olarak tasarlanmış bir kedi barınağında geçen bir gizli nesne oyunudur. Bu kedilerin sonsuza dek evlerini bulmalarına yardımcı olmak için bir hayır partisi hazırlayan Barınak müdürü Hannah'ya katılın. Sevginin sınırı olmadığını gösterelim!<br><br><img class=""bb_img"" src=""https://shared.akamai.steamstatic.com/store_item_assets/steam/apps/3087650/extras/sheltergif.gif?t=1741878136"" /><br><br><img class=""bb_img"" src=""https://shared.akamai.steamstatic.com/store_item_assets/steam/apps/3087650/extras/textborder.png?t=1741878136"" /><br><strong>Sokakta yürürken bir sokak kedisiyle karşılaştığınız zamanları bilirsiniz. <br>Onun için üzülürsünüz ve hak ettiği tüm sevgiyi ona vermek istersiniz, değil mi? <br>Adım Hannah ve eskiden ben de böyle hissederdim. <br>Sonra bir adım öne çıkmaya ve bir şeyler yapmaya karar verdim.<br>Şimdi özel ihtiyaçları olan kedileri kurtarıyorum; çünkü genellikle göz ardı ediliyorlar. <br>Onlara bakmama yardım eder misin? <br>Sizi &quot;A SHELTER FULL OF CATS&quot;te bekliyor olacağım.<br>Dünyayı daha iyi bir yer haline getirelim! </strong>❤️<img class=""bb_img"" src=""https://shared.akamai.steamstatic.com/store_item_assets/steam/apps/3087650/extras/text.png?t=1741878136"" />",$2.90 USD,9 Ara 2024,"windows, linux",Devcats,"Basit Eğlence, Bağımsız Yapımcı","Tek Oyunculu, Steam Başarımları, Steam Koleksiyon Kartları, Aile Paylaşımı","Tek Oyunculu, Steam Başarımları, Steam Koleksiyon Kartları, Aile Paylaşımı",,"<strong>Minimum:</strong><br><ul class=""bb_ul""><li>64-bit işlemci ve işletim sistemi gerektirir<br></li><li><strong>İşletim Sistemi:</strong> Windows 10 or superior<br></li><li><strong>İşlemci:</strong> Requires a 64-bit processor and operating system<br></li><li><strong>Bellek:</strong> 1 GB RAM<br></li><li><strong>Ekran Kartı:</strong> 512 MB display memory<br></li><li><strong>Depolama:</strong> 600 MB kullanılabilir alan<br></li><li><strong>Ses Kartı:</strong> DirectSound-compatible sound card</li></ul>","<strong>Önerilen:</strong><br><ul class=""bb_ul""><li>64-bit işlemci ve işletim sistemi gerektirir</li></ul>",0,"www.devcatsgames.com, innerself.indiegames@gmail.com"
3086060,Date Banger,game,"Modern Bir Flört Deneyimi<br><br><img class=""bb_img"" src=""https://shared.akamai.steamstatic.com/store_item_assets/steam/apps/3086060/extras/dateBangerPhone.gif?t=1735142487"" /><br><br> Date Banger'da modern flörtü hiç olmadığı gibi deneyimleyin! Tıpkı bir flört uygulamasında olduğu gibi videolar arasında kaydırın ve beğendiğiniz kızlarla bağlantı kurun. Mesajlarınıza yanıt veren kızları evinize davet edin ve heyecan verici bir randevu partisi düzenleyin, böylece birbirinizi daha iyi tanıyabilirsiniz.<br><br>İlişkiniz ilerledikçe, daha derin bir bağ kurma şansınız artar. Bir kızı beğenmediniz mi? Bir sonrakine geçin—her kızın kendine özgü bir deneyimi vardır. Size en uygun olanı bulun ve tarzınıza mükemmel şekilde uyanı keşfedin.<br><br><img class=""bb_img"" src=""https://shared.akamai.steamstatic.com/store_item_assets/steam/apps/3086060/extras/datebanger_2.gif?t=1735142487"" /><br><br>Tamamen etkileşimli telefonunuzu kullanarak kızları arayın, onlara ne yapmak istediğinizi söyleyin ve onları davet edin. Hediyeler göndererek ilişkilerinizi güçlendirin, ancak unutmayın ki her kızın farklı tercihleri vardır. Bazıları mücevheri severken, diğerleri uzun bir çubuğu hiçbir şeye değişmez.<br><br><img class=""bb_img"" src=""https://shared.akamai.steamstatic.com/store_item_assets/steam/apps/3086060/extras/datebanger_1.gif?t=1735142487"" /><br><br>Para kazanmak için risk alın; pasif gelir yeterli değilse, zengin olma fırsatları için telefonunuzu kullanın. Evinizi yükseltin ve küvet, salıncak ve mutfak tezgahı gibi farklı alanların keyfini çıkarın. Ortamı taze ve eğlenceli tutmak için yeni müzikler satın alın.<br><br>Date Banger'da kızların size aşık olmaması için hiçbir neden yok!<br><br><img class=""bb_img"" src=""https://shared.akamai.steamstatic.com/store_item_assets/steam/apps/3086060/extras/datebanger_0.gif?t=1735142487"" />",$5.79 USD,23 Ara 2024,windows,Dijimit,"Aksiyon, Basit Eğlence, Bağımsız Yapımcı, RYO, Simülasyon, Strateji, Erken Erişim","Tek Oyunculu, Remote Play Together, Aile Paylaşımı","Tek Oyunculu, Remote Play Together, Aile Paylaşımı",,"<strong>Minimum:</strong><br><ul class=""bb_ul""><li>64-bit işlemci ve işletim sistemi gerektirir<br></li><li><strong>İşletim Sistemi:</strong> Microsoft Windows 10+<br></li><li><strong>İşlemci:</strong> Intel(R) Core(TM) i3 6300<br></li><li><strong>Bellek:</strong> 8 GB RAM<br></li><li><strong>Ekran Kartı:</strong> NVIDIA GeForce GTX 660<br></li><li><strong>Depolama:</strong> 8 GB kullanılabilir alan</li></ul>","<strong>Önerilen:</strong><br><ul class=""bb_ul""><li>64-bit işlemci ve işletim sistemi gerektirir<br></li><li><strong>İşletim Sistemi:</strong> Microsoft Windows 10+<br></li><li><strong>İşlemci:</strong> Intel(R) Core(TM) i5 6400<br></li><li><strong>Bellek:</strong> 16 GB RAM<br></li><li><strong>Ekran Kartı:</strong> NVIDIA GeForce GTX 1060<br></li><li><strong>Depolama:</strong> 8 GB kullanılabilir alan</li></ul>",0,", dijimit@gmail.com"
