ID,Name,Type,Detailed Description,Price,Release Date,Platforms,Developers,Genres,Categories,Game Modes,Features,System Requirements (Min.),System Requirements (Rec.),Age Rating,Links
2607620,Ucube Avcıları,game,"<u><strong>Oyun Konsepti:</strong></u><br><br>&quot;Ucube Avcıları,&quot; Kayı oba'sının sakin günlerini tehdit eden Sir Baso ve ucube ordusuyla dolu komik bir macerayı anlatır. Oyuncular, genç ve cesur savaşçı Memed olarak başlayarak Kayı obasını bu absürd tehdide karşı savunmak ve ucube avcısı olmak için göreve atılırlar.<br><br><u><strong>Oyun Mekaniği:</strong></u><br><br><u><strong>Sıra Tabanlı Savaşlar:</strong></u><br><br>Oyun, sıra tabanlı savaş mekaniğine dayanır. Oyuncular, savaşlarda stratejik hamleler yaparlar ve komik yetenekleri kullanarak ucubelerle savaşırlar.<br><br><u><strong>Kararlar ve Diyaloglar:</strong></u><br><br>Oyunda oyuncular, karakterlerle etkileşime girer ve hikayeyi ilerletmek için kararlar alır. Diyaloglar komik ve mizahi unsurlar içerir ve oyuncuların hikayeyi nasıl şekillendireceğine bağlı olarak farklı sonuçlara yol açar.<br><br><u><strong>Gelişim ve Beceri:</strong></u><br><br>Oyuncular, Memed ve yoldaşlarını geliştirmek için deneyim puanları kazanır ve yeni yetenekler öğrenirler. Bu yetenekler savaşlarda ve görevlerde kullanılır.<br><br><u><strong>Hikaye ve Mizah:</strong></u><br><br>Oyunun temel odak noktası mizahdır. Komik diyaloglar, tuhaf karakterler ve absürd olaylarla dolu bir hikaye, oyuncuları güldürürken aynı zamanda eğlenceli bir macera sunar. Sir Baso'nun ucube ordusu, farklı türlerden ve boyutlardan gelen çılgın yaratıklarla doludur.<br><br><br><u><strong>Sonuç:</strong></u><br><br>&quot;Ucube Avcıları,&quot; sıra tabanlı strateji ve mizahı bir araya getiren eğlenceli bir macera sunar. Oyuncular, Memed'in liderliğinde Kayı obasını ucube tehlikesinden korumak için komik dialoglar, absürd yaratıklar ve stratejik savaşlarla dolu bir dünyada heyecanlı bir yolculuğa çıkarlar.<br><br><img class=""bb_img"" src=""https://shared.akamai.steamstatic.com/store_item_assets/steam/apps/2607620/extras/arap.wmv_000000875__1_.gif?t=1696592205"" />",$1.99 USD,6 Eki 2023,windows,Tengger Cavalry,"Macera, Basit Eğlence, Bağımsız Yapımcı, RYO","Tek Oyunculu, Tam kontrolcü desteği, Aile Paylaşımı","Tek Oyunculu, Tam kontrolcü desteği, Aile Paylaşımı",,"<strong>Minimum:</strong><br><ul class=""bb_ul""><li><strong>İşletim Sistemi *:</strong> Microsoft Windows® 8.1/10/11 (64bit)<br></li><li><strong>İşlemci:</strong> Intel Core i3-4340 or better<br></li><li><strong>Bellek:</strong> 8 GB RAM<br></li><li><strong>Ekran Kartı:</strong> Compatible OpenGL / VRAM 1GB or better<br></li><li><strong>Depolama:</strong> 4 GB kullanılabilir alan<br></li><li><strong>İlave Notlar:</strong> 1280x768 or better Display</li></ul>","<strong>Önerilen:</strong><br><ul class=""bb_ul""><li><strong>Bellek:</strong> 8 GB RAM<br></li><li><strong>Depolama:</strong> 4 GB kullanılabilir alan</li></ul>",0,", teenggercavalry@gmail.com"
2606920,Field of Honor,game,"<p class=""bb_paragraph"">Field of Honor is a singleplayer, blend of first-person shooter and strategic warfare set amidst the gripping backdrop of Napoleonic Wars, American Revolutionary War and American Civil War.  </p><p class=""bb_paragraph""></p><h2 class=""bb_tag"">First Person Gameplay</h2><p class=""bb_paragraph"">Prepare to be a foot soldier or cavalry in AI controlled battles. </p><p class=""bb_paragraph""></p><p class=""bb_paragraph""><img class=""bb_img"" src=""https://shared.akamai.steamstatic.com/store_item_assets/steam/apps/2606920/extras/lineinf3.gif?t=1740300886"" /></p><p class=""bb_paragraph""><img class=""bb_img"" src=""https://shared.akamai.steamstatic.com/store_item_assets/steam/apps/2606920/extras/prussian_infantry.gif?t=1740300886"" /></p><h2 class=""bb_tag"">Strategy Gameplay</h2><p class=""bb_paragraph"">Command your army in first person or directly on strategy map.</p><p class=""bb_paragraph""></p><p class=""bb_paragraph""><img class=""bb_img"" src=""https://shared.akamai.steamstatic.com/store_item_assets/steam/apps/2606920/extras/camander.gif?t=1740300886"" /></p><h2 class=""bb_tag"">Big Scale</h2><p class=""bb_paragraph"">Field of Honor brings to life the epic clashes of the past, featuring breathtaking engagements with over 1000+ units on the battlefield simultaneously. </p><p class=""bb_paragraph""></p><p class=""bb_paragraph""><img class=""bb_img"" src=""https://shared.akamai.steamstatic.com/store_item_assets/steam/apps/2606920/extras/cavalry_new.gif?t=1740300886"" /></p><h2 class=""bb_tag"">Key Features</h2><p class=""bb_paragraph""></p><p class=""bb_paragraph""><strong>Napoleonic Wars Nations:</strong>  </p><p class=""bb_paragraph"">Play with France, Austria, Prussia, Great Britain, Russia, Spain, Sweden, Portugal, Kingdom of Italy, Ottoman Empire, Duchy of Warsaw, United States, Bavaria , Kingdom of Naples, Duchy of Nassau, Swiss Confederation, Kingdom of Holland, Denmark-Norway and Westphalia.   </p><p class=""bb_paragraph""></p><p class=""bb_paragraph""><img class=""bb_img"" src=""https://shared.akamai.steamstatic.com/store_item_assets/steam/apps/2606920/extras/flags.png?t=1740300886"" /></p><p class=""bb_paragraph""><strong>American Revolutionary War Nations:</strong>  </p><p class=""bb_paragraph"">Play with revolutionary era United States or Great Britain.</p><p class=""bb_paragraph""></p><p class=""bb_paragraph""><img class=""bb_img"" src=""https://shared.akamai.steamstatic.com/store_item_assets/steam/apps/2606920/extras/flags_revolution.png?t=1740300886"" /></p><p class=""bb_paragraph""></p><p class=""bb_paragraph""><strong>American CivilWar Nations:</strong>   </p><p class=""bb_paragraph"">Play with civil war era Union or Confederate.</p><p class=""bb_paragraph""></p><p class=""bb_paragraph""></p><p class=""bb_paragraph""></p><p class=""bb_paragraph""><strong>Different Units:</strong></p><p class=""bb_paragraph"">Each nations has its own units in 3 different category; Artillery, Cavalry and Infantry.</p><p class=""bb_paragraph""></p><p class=""bb_paragraph""><strong>Command on Map:</strong></p><p class=""bb_paragraph"">Command your army corps over command map easily.</p><p class=""bb_paragraph""></p><p class=""bb_paragraph""><strong>Command in FPS:</strong></p><p class=""bb_paragraph"">You can also control units with FPS view and make them to charge, attack or move etc.</p><p class=""bb_paragraph""></p><p class=""bb_paragraph""><strong>Meelee Combat</strong></p><p class=""bb_paragraph"">Take up your sword and command a bayonet charge!</p><p class=""bb_paragraph""></p><p class=""bb_paragraph""><strong>AI Commander:</strong></p><p class=""bb_paragraph"">Enemy is commanded by AI. Also you can leave friendly units comanded by AI and just fight as a single soldier in massive battle.</p><p class=""bb_paragraph""></p><p class=""bb_paragraph""><strong>4 Different Mods:</strong></p><p class=""bb_paragraph"">Play in Conquest, Defense, Assault and Custom Battle modes for immerse different gameplay.</p><p class=""bb_paragraph""></p><h2 class=""bb_tag"">Roadmap</h2><p class=""bb_paragraph""></p><p class=""bb_paragraph"">Field of Honor is developed as Earcly Access game. So there is more to come. We plan make updates in montly period. Key features that we plan to add are:</p><p class=""bb_paragraph""></p><ul class=""bb_ul""><li><p class=""bb_paragraph"">Historical Battles.</p></li></ul><ul class=""bb_ul""><li><p class=""bb_paragraph"">New nations of Napoleonic wars.</p></li></ul><ul class=""bb_ul""><li><p class=""bb_paragraph"">New units for each nation.</p></li></ul><ul class=""bb_ul""><li><p class=""bb_paragraph"">Cannon, rocket and other tools control</p></li></ul><ul class=""bb_ul""><li><p class=""bb_paragraph"">New missile and melee weapons</p></li></ul>",$1.99 USD,29 Şub 2024,windows,civciv,"Basit Eğlence, Bağımsız Yapımcı, Simülasyon, Strateji, Erken Erişim","Tek Oyunculu, Aile Paylaşımı","Tek Oyunculu, Aile Paylaşımı",,"<strong>Minimum:</strong><br><ul class=""bb_ul""><li>64-bit işlemci ve işletim sistemi gerektirir<br></li><li><strong>İşletim Sistemi *:</strong> Windows 7 32-bit<br></li><li><strong>İşlemci:</strong> 1.8ghz<br></li><li><strong>Bellek:</strong> 4 GB RAM<br></li><li><strong>Ekran Kartı:</strong> Intel hd graphics<br></li><li><strong>Depolama:</strong> 1 GB kullanılabilir alan</li></ul>","<strong>Önerilen:</strong><br><ul class=""bb_ul""><li>64-bit işlemci ve işletim sistemi gerektirir<br></li><li><strong>İşletim Sistemi:</strong> Windows 10/11 64-bit<br></li><li><strong>İşlemci:</strong> 3 GHz<br></li><li><strong>Bellek:</strong> 8 GB RAM<br></li><li><strong>Ekran Kartı:</strong> Gtx 970<br></li><li><strong>Depolama:</strong> 1 GB kullanılabilir alan</li></ul>",0,"https://civcivgames.com/, support@civcivgames.com"
2604420,Euro Truck Simulator 2 - Greece,dlc,"<p class=""bb_paragraph"">Heyecan verici bir yolculuğa çıkmaya hazır olun! Bu kez, Yunanistan’ın büyüleyici manzaralarını keşfedeceksiniz. Her yolculuk ülkenin göz alıcı güzelliklerini ve zengin tarihini ortaya çıkarıyor. Yunanistan’ın iç bölgelerinin cazibesini keşfedin ve yaklaşık 14 şehri gezme fırsatı yakalayın. Kendinizi, sanki bir kartpostalın içindeymiş gibi görünen köylerde dolaşırken, kıvrımlı yollarda ilerlerken ve simgesel yapıları geçerken hayal edin. Yunan kültürünün yüzyıllara dayanan dokusunu deneyimleyin.</p><p class=""bb_paragraph"">Sadece bununla da sınırlı değil  Yunanistan, taşıma deneyiminize yeni bir boyut katıyor; oteller ve pamuk tarlaları yeni depolar olarak karşınıza çıkacak. Alışılmışın dışında bir yolculuğa hazır olun; bu Akdeniz cennetinin güneşle yıkanmış sahillerini ve kültürel zenginliklerini keşfedin. Yolculuk maceralarınız şimdi yeni bir seviyeye çıkıyor!</p>",$5.44 USD,4 Ara 2024,"windows, mac, linux",SCS Software,"Bağımsız Yapımcı, Simülasyon","Tek Oyunculu, Çok Oyunculu, Eşli, Çevrimiçi Eşli, İndirilebilir İçerik, Steam Başarımları, Steam Koleksiyon Kartları, Steam Atölyesi, Kısmi kontrolcü desteği, Steam Cloud, Bölüm düzenleyicisi içerir, Telefonda Remote Play, Tablette Remote Play, Remote Play Together, Aile Paylaşımı","Tek Oyunculu, Çok Oyunculu, Eşli, Çevrimiçi Eşli, İndirilebilir İçerik, Steam Başarımları, Steam Koleksiyon Kartları, Steam Atölyesi, Kısmi kontrolcü desteği, Steam Cloud, Bölüm düzenleyicisi içerir, Telefonda Remote Play, Tablette Remote Play, Remote Play Together, Aile Paylaşımı",,"<strong>Minimum:</strong><br><ul class=""bb_ul""><li><strong>OS *:</strong> Windows 7<br></li><li><strong>Processor:</strong> Dual core CPU 2.4 GHz<br></li><li><strong>Memory:</strong> 4 GB RAM<br></li><li><strong>Graphics:</strong> GeForce GTS 450-class (Intel HD 4000)<br></li><li><strong>Hard Drive:</strong> 12 GB available space</li></ul>","<strong>Recommended:</strong><br><ul class=""bb_ul""><li><strong>OS *:</strong> Windows 7/8.1/10 64-bit<br></li><li><strong>Processor:</strong> Quad core CPU 3.0 GHz<br></li><li><strong>Memory:</strong> 6 GB RAM<br></li><li><strong>Graphics:</strong> GeForce GTX 760-class (2 GB)<br></li><li><strong>Hard Drive:</strong> 12 GB available space</li></ul>",0,"https://eurotrucksimulator2.com/support.php, support@eurotrucksimulator2.com"
2601580,Paradise's Secrets,game,"<h1>Join the Paradise's Secrets Discord server</h1><p></p><br><h1>Oyun Açıklaması</h1><p class=""bb_paragraph""><img class=""bb_img"" src=""https://shared.akamai.steamstatic.com/store_item_assets/steam/apps/2601580/extras/Calsma_Yuzeyi_4.png?t=1741899642"" /></p><p class=""bb_paragraph"">Paradise's Secrets, Unreal Engine 5 ile geliştirilmiş bir korku oyunudur. Etkileyici ve sürükleyici hikayesi ile her an dolu dolu ve korkunç geçecek. Paradise şirketinin sırrını öğrenirken yaşanan her şeyi iliklerinize kadar hissedeceksiniz.</p><p class=""bb_paragraph""></p><p class=""bb_paragraph"">Paradise şirketi sanıldığının aksine masum değil, Paradise şirketinin sırrını ortaya çıkarmak senin elinde ama bu hiç kolay olmayacak çünkü geçmişin izleri ebediyen kalır ve bu izler sırları öğrenirken seni de o anki gibi etkileyebilir. Tüm sırları öğrendiğinde hiç bir şey sandığın gibi olmayabilir.</p><p class=""bb_paragraph""><strong><u>Oyunu tamamlamak için ortalama süre: 240 dakika</u></strong></p><p class=""bb_paragraph"">                                                      <img class=""bb_img"" src=""https://shared.akamai.steamstatic.com/store_item_assets/steam/apps/2601580/extras/Calsma_Yuzeyi_1.png?t=1741899642"" /></p><p class=""bb_paragraph""><img class=""bb_img"" src=""https://shared.akamai.steamstatic.com/store_item_assets/steam/apps/2601580/extras/paradise.gif?t=1741899642"" /></p><p class=""bb_paragraph"">Paradise Şirketine hoş geldin seni burda görmekten mutluluk duyuyoruz. Paradise ile çalışarak dünyadaki insanları kurtarabilirsin, yapman gereken tek şey bize yardım eden Frightened ekibine katılmak. Frightened ekibi ile kötü ruhları yakalayıp insanlara zarar vermesini engelleyebilirsin. Unutma Paradise bir dünya şirketidir ve dünyayı en iyi hale getirmek için çalışır :)</p><p class=""bb_paragraph""></p><p class=""bb_paragraph""><img class=""bb_img"" src=""https://shared.akamai.steamstatic.com/store_item_assets/steam/apps/2601580/extras/Calsma_Yuzeyi_2.png?t=1741899642"" /></p><p class=""bb_paragraph""><img class=""bb_img"" src=""https://shared.akamai.steamstatic.com/store_item_assets/steam/apps/2601580/extras/yol_bul.gif?t=1741899642"" /></p><p class=""bb_paragraph"">Karanlıkta yolunu bulmak için anıların gömülü olduğu kameranın flaş ışığını kullanarak yolunu aydınlatıp devam etmen gerek. Ancak flaşı doğru anlarda kullanmalısın çünkü kullanım süresi var eğer süreyi tutturamaz isen kötü şeyler olabilir. </p><p class=""bb_paragraph""></p><p class=""bb_paragraph""><img class=""bb_img"" src=""https://shared.akamai.steamstatic.com/store_item_assets/steam/apps/2601580/extras/Calsma_Yuzeyi_3.png?t=1741899642"" /></p><p class=""bb_paragraph""><img class=""bb_img"" src=""https://shared.akamai.steamstatic.com/store_item_assets/steam/apps/2601580/extras/çeşitlilik.gif?t=1741899642"" /></p><p class=""bb_paragraph"">Birden fazla mekanda bulunarak Paradise Şirketinin amacını ve sırlarını öğreneceksin. Tüm mekanlar birbirinden bağımsız ve Paradise Şirketinin sırlarını öğrenmen için özenle seçilmiş yerler, sırları öğrenirken orda yaşanan tüm acıları, tüm korkuları sen de tatmak zorundasın ama sonucunda mutlak doğru ile yüzleşeceksin. Unutma yarım kalmış hayatlara verilen zararların acısını her daim çekmek zorundasın.</p>",$4.49 USD,13 Ara 2024,windows,Entry Studios,"Aksiyon, Macera, Bağımsız Yapımcı","Tek Oyunculu, Steam Başarımları, Aile Paylaşımı","Tek Oyunculu, Steam Başarımları, Aile Paylaşımı",,"<strong>Minimum:</strong><br><ul class=""bb_ul""><li>64-bit işlemci ve işletim sistemi gerektirir<br></li><li><strong>İşletim Sistemi:</strong> Windows 10<br></li><li><strong>İşlemci:</strong> Intel Core i7-7700K<br></li><li><strong>Bellek:</strong> 8 GB RAM<br></li><li><strong>Ekran Kartı:</strong> Geforce 1050 Ti<br></li><li><strong>DirectX:</strong> Sürüm 12<br></li><li><strong>Depolama:</strong> 10 GB kullanılabilir alan</li></ul>","<strong>Önerilen:</strong><br><ul class=""bb_ul""><li>64-bit işlemci ve işletim sistemi gerektirir<br></li><li><strong>İşletim Sistemi:</strong> Windows 10<br></li><li><strong>İşlemci:</strong> Intel Core i7-12700K<br></li><li><strong>Bellek:</strong> 16 GB RAM<br></li><li><strong>Ekran Kartı:</strong> RTX 3060<br></li><li><strong>DirectX:</strong> Sürüm 12<br></li><li><strong>Depolama:</strong> 10 GB kullanılabilir alan</li></ul>",0,"https://www.entrystudios.com, studiosentry4@gmail.com"
2599300,Dead Signal,game,"<h2 class=""bb_tag""><strong>Monitör</strong></h2>Gece boyunca <strong>23 </strong>kameranın hepsini izlemen istenecek. Ortaya çıkan farkları başarıyla fark edip uygun rapor kategorisini seçmek, saatlik kotanı doldurmana yardımcı olacaktır. Arada sırada uzaktan kamera tamirleri ve bağlantı hataları ilerlemeni engelleyebilir haliyle acil müdahale gerektirebilir.<br><img class=""bb_img"" src=""https://shared.akamai.steamstatic.com/store_item_assets/steam/apps/2599300/extras/DS_Cameras.gif?t=1726924697"" /><h2 class=""bb_tag""><strong>Hareket Et</strong></h2>Gerek uydudaki bağlantı hatalarınının düzeltilmesi gerek teslim edilecek şüpheli paketleri toplamak olsun, çatıya erişmen gerekecektir. Neyse ki, apartmandan sadece kısa bir asansör yolculuğu kadar uzakta. Bulunduğun yerin kilidini açık bırakmak, davetsiz misafirlerin girmesine sebep olabilir, bu nedenle hızlı hareket et. Geri döndüğün zaman üretilen tuş takımı kodunu girerek kapıyı kilitlediğinden emin ol.<br><img class=""bb_img"" src=""https://shared.akamai.steamstatic.com/store_item_assets/steam/apps/2599300/extras/DS_Drone.gif?t=1726924697"" /><h2 class=""bb_tag""><strong>Hayatta Kal</strong></h2>Apartman kompleksinde nerede olursan ol, her an sonun gelebilir. Sadece kameraları izlemekle kalmayıp, kendi çevreni de dikkatlice izle. Güneşin tekrar doğmasının tek yolu ikisini de yönetmek<br><img class=""bb_img"" src=""https://shared.akamai.steamstatic.com/store_item_assets/steam/apps/2599300/extras/DS_BedHide.gif?t=1726924697"" /><h2 class=""bb_tag""><strong>Hikaye</strong></h2>2021 itibarıyla yalnızca ABD'de 85 milyondan fazla güvenlik kamerası bulunmakta. Yarısından fazlası rahat bir şekilde ihlal ediliyor—işletmeleri, halka açık parkları, toplu ulaşımı izliyorlar... daha da ötesi evlerinizi bile. Bu gibi alanlara gizli kameraların yerleştirilmesi de yaygındır, aslında bunun arkasında çok büyük bir sektör var. <br><br>Bu, karanlık kişi ve kuruluşlar için bir gelir kaynağı seçeneği sunuyor. Darknet'in gölgelerinin arkasında faaliyeti olan kuruluşlar. Tesadüfen siz de &quot;The Shade&quot; adlı işveren tarafından yönetilen ViVEX adlı bir örgütte çalışıyorsunuz.<br><br>İşverenini memnun etmek için camSPY ağını izlemekle görevlendirildin. Hacklenmiş ve gizli kameralardan oluşan bir ağ bu. Müşterileri memnuniyeti için &quot;ilgi çekici&quot; her şeyi rapor etmelisin. Ancak zaman paradır ve saatlik kotanı doldurmalısın aksi halde işine son verilir. <br><br>Bir girişimci olarak &quot;The Shade&quot; , şehrin baştan savma bir bölgesinde yaşadığını fark etti ve bundan faydalanmaya karar verdi. Vardiyan boyunca apartman kompleksindeki kiracılara &quot;paketler&quot; teslim edeceksin.  <br><br>Hazırlan… Vardiyan başlamak üzere... Pürüzsüz bir gece olmalı…  Öyle değil mi?",$7.29 USD,20 Eki 2023,windows,Reflect Studios,Simülasyon,"Tek Oyunculu, Steam Başarımları, Tam kontrolcü desteği, Aile Paylaşımı","Tek Oyunculu, Steam Başarımları, Tam kontrolcü desteği, Aile Paylaşımı",,"<strong>Minimum:</strong><br><ul class=""bb_ul""><li>64-bit işlemci ve işletim sistemi gerektirir<br></li><li><strong>İşletim Sistemi:</strong> 64-bit Windows 10<br></li><li><strong>İşlemci:</strong> Core i7-6700 or Ryzen 5 1600<br></li><li><strong>Bellek:</strong> 8 GB RAM<br></li><li><strong>Ekran Kartı:</strong> GeForce GTX 1060 6GB or Radeon RX 580 8GB<br></li><li><strong>DirectX:</strong> Sürüm 12<br></li><li><strong>Depolama:</strong> 8 GB kullanılabilir alan<br></li><li><strong>İlave Notlar:</strong> For lower end hardware, you can run the game on lower graphic settings. Game is optimized for 1080p and 16x9 aspect ratio.</li></ul>","<strong>Önerilen:</strong><br><ul class=""bb_ul""><li>64-bit işlemci ve işletim sistemi gerektirir</li></ul>",0,"http://www.reflectstudios.com, "
2598930,Game Store Simulator,game,"<strong>Game Store Simulator, video oyunları alıp satmanın ön planda olduğu bir oyundur, oyun meraklıları ve yönetim, simülasyon sevenler için mükemmel bir seçimdir. Ucuza alın ve kar için satın, işinizi giderek büyütün.<br><br>Adanın ortasında terk edilmiş bir oyun mağazası satın alın ve eski ihtişamına kavuşturun. Çöplerden kurtulun müşterilere hazır hale getirmek için zemini temizleyin, raf yerleştirin ve mekanı istediğiniz gibi dekore edin.</strong><br><br><img class=""bb_img"" src=""https://shared.akamai.steamstatic.com/store_item_assets/steam/apps/2598930/extras/SellGame_Turkish.png?t=1726887346"" /><br><img class=""bb_img"" src=""https://shared.akamai.steamstatic.com/store_item_assets/steam/apps/2598930/extras/New_SellGame.gif?t=1726887346"" /><h2 class=""bb_tag"">Oyun Sat :</h2><strong>Video oyunlarını raflarınıza yerleştirmek için sınırsız çeşitlilik. İstediğiniz bayrak şeklini bile yapabilirsiniz.</strong><br><br><img class=""bb_img"" src=""https://shared.akamai.steamstatic.com/store_item_assets/steam/apps/2598930/extras/Maintenance_Turkish.png?t=1726887346"" /><br><img class=""bb_img"" src=""https://shared.akamai.steamstatic.com/store_item_assets/steam/apps/2598930/extras/New_Maintenance.gif?t=1726887346"" /><h2 class=""bb_tag"">Bakım Yap :</h2><strong>Aracınıza iyi bakmayı unutmayın! Kimse yolda kalmak istemez. Benzin doldurabilir ve aracınız hasar görmüşse aracınızı tamir edebilirsiniz</strong><br><br><img class=""bb_img"" src=""https://shared.akamai.steamstatic.com/store_item_assets/steam/apps/2598930/extras/Hire_Turkish.png?t=1726887346"" /><br><img class=""bb_img"" src=""https://shared.akamai.steamstatic.com/store_item_assets/steam/apps/2598930/extras/New_Hire.gif?t=1726887346"" /><h2 class=""bb_tag"">Eleman Kirala :</h2><strong>İşleri sizin için çok daha kolay hale getirecek bir çalışan kiralayın, satışlarınız kendi kendine hallolacaktır.</strong><br><br><img class=""bb_img"" src=""https://shared.akamai.steamstatic.com/store_item_assets/steam/apps/2598930/extras/Expand_Turkish.png?t=1726887346"" /><br><img class=""bb_img"" src=""https://shared.akamai.steamstatic.com/store_item_assets/steam/apps/2598930/extras/New_Expand.gif?t=1726887346"" /><h2 class=""bb_tag"">Genişlet :</h2><strong>Küçük kalmak zorunda değilsiniz. Daha fazla müşteriye hizmet verebilmek için oyun mağazanızı genişletebilirsiniz.</strong><br><br><img class=""bb_img"" src=""https://shared.akamai.steamstatic.com/store_item_assets/steam/apps/2598930/extras/Decorate_Turkish.png?t=1726887346"" /><br><img class=""bb_img"" src=""https://shared.akamai.steamstatic.com/store_item_assets/steam/apps/2598930/extras/New_Decorate.gif?t=1726887346"" /><h2 class=""bb_tag"">Mağazanı Dekore Et :</h2><strong>Mağazanızı çok çeşitli seçeneklerle istediğiniz gibi dekore edin ve müşterilerinizi daha da memnun edin.</strong><br><br><img class=""bb_img"" src=""https://shared.akamai.steamstatic.com/store_item_assets/steam/apps/2598930/extras/Cars_Turkish.png?t=1726887346"" /><br><img class=""bb_img"" src=""https://shared.akamai.steamstatic.com/store_item_assets/steam/apps/2598930/extras/New_Cars.gif?t=1726887346"" /><h2 class=""bb_tag"">Araçlar :</h2><strong>Farklı taşıma kapasitelerine sahip araçlarla daha fazla oyun taşıyabilir ve işinizi büyütebilirsiniz</strong><br><br><img class=""bb_img"" src=""https://shared.akamai.steamstatic.com/store_item_assets/steam/apps/2598930/extras/SkillTree_Turkish.png?t=1726887346"" /><br><img class=""bb_img"" src=""https://shared.akamai.steamstatic.com/store_item_assets/steam/apps/2598930/extras/New_SkillTree.gif?t=1726887346"" /><h2 class=""bb_tag"">Yetenek Ağacı :</h2><strong>Beceri ağacı ile birçok geliştirme kazanabilir ve işinizi kolaylaştırabilirsiniz</strong><h2 class=""bb_tag""><strong>Oyunun bazı özellikleri şunlardır; </strong></h2><br><ul class=""bb_ul""><li>10'dan fazla araba ve kamyon <br></li><li>9+ Satılacak farklı video oyunu kategorisi <br></li><li>Diyaloglu araba alım satım sistemleri <br></li><li>Araç kaza ve onarım sistemi <br></li><li>Araba yakıt sistemi <br></li><li>Bilgisayar sistemi <br></li><li>vergi̇lendi̇rme ve faturalandirma si̇stemleri̇ <br></li><li>Beceri ağacı sistemi <br></li><li>Online satış sistemi <br></li><li>İşçi kiralama sistemi <br></li><li>Bina yükseltme sistemi <br></li><li>Mağaza dekorasyon sistemi <br></li><li>Ve daha fazlası</li></ul>",$1.27 USD,20 Ağu 2024,windows,Pex Entertainment,"Bağımsız Yapımcı, Simülasyon","Tek Oyunculu, Steam Başarımları, Aile Paylaşımı","Tek Oyunculu, Steam Başarımları, Aile Paylaşımı",,"<strong>Minimum:</strong><br><ul class=""bb_ul""><li><strong>İşletim Sistemi *:</strong> Windows 7<br></li><li><strong>İşlemci:</strong> 2 GHz Dual Core CPU<br></li><li><strong>Bellek:</strong> 2 GB RAM<br></li><li><strong>Ekran Kartı:</strong> Intel HD Graphics 4000 or better<br></li><li><strong>Depolama:</strong> 5 GB kullanılabilir alan</li></ul>","<strong>Önerilen:</strong><br><ul class=""bb_ul""><li><strong>İşletim Sistemi:</strong> Windows 10<br></li><li><strong>İşlemci:</strong> 2.5 GHz Dual Core CPU<br></li><li><strong>Bellek:</strong> 4 GB RAM<br></li><li><strong>Ekran Kartı:</strong> Geforce GTX 970/Radeon RX470 or better<br></li><li><strong>Depolama:</strong> 5 GB kullanılabilir alan</li></ul>",0,", pexentertainmentsteam@gmail.com"
